{
 "name": "fs-path-names",
 "family": "agent",
 "authority": "pinned Pi b7bb00b9 packages/agent/src/harness/env/nodejs.ts NodeExecutionEnv (imported unmodified) + coding-agent core/tools/file-mutation-queue.ts getMutationQueueKey (sliced unmodified), Node 22.15.1, identical on Linux (node:22.15.1-alpine) and Windows 11 (L12-D001 authority)",
 "pi_revision": "b7bb00b936dbe21b8e160b3e89efdec361846699",
 "requirements": [
  "EXEC-002",
  "EXEC-003"
 ],
 "witnesses": [
  "fs_path_javascript_string_domain"
 ],
 "platforms": [
  "linux",
  "win32"
 ],
 "notes": "Each name (BMP, valid pair, explicit U+FFFD, unpaired high/low at start/middle/end, mixed, low-then-high) as the final component and as a directory component: target_key while missing (raw), write, read via the name and via its explicit U+FFFD spelling, listing (projected), canonical_path (projected), target_key once existing (projected), absolute_path (logical, raw), exists, file_info (logical name). GENERATED from the pinned-Pi L12-D001 probe; regenerate with harness/make_scenarios.py.",
 "fs_path_domain": {
  "cases": [
   {
    "id": "file/bmp",
    "steps": [
     {
      "op": "target_key",
      "path": {
       "utf16": [
        102,
        233,
        46,
        116,
        120,
        116
       ]
      },
      "expect": {
       "components": [
        [
         102,
         233,
         46,
         116,
         120,
         116
        ]
       ]
      }
     },
     {
      "op": "write_file",
      "path": {
       "utf16": [
        102,
        233,
        46,
        116,
        120,
        116
       ]
      },
      "content": [
       99,
       111,
       110,
       116,
       101,
       110,
       116
      ],
      "expect": {
       "ok": null
      }
     },
     {
      "op": "read_text_file",
      "path": {
       "utf16": [
        102,
        233,
        46,
        116,
        120,
        116
       ]
      },
      "expect": {
       "ok": [
        99,
        111,
        110,
        116,
        101,
        110,
        116
       ]
      }
     },
     {
      "op": "read_text_file",
      "path": {
       "utf16": [
        102,
        233,
        46,
        116,
        120,
        116
       ]
      },
      "expect": {
       "ok": [
        99,
        111,
        110,
        116,
        101,
        110,
        116
       ]
      }
     },
     {
      "op": "list_dir",
      "path": {
       "utf16": [
        46
       ]
      },
      "expect": {
       "names": [
        [
         102,
         233,
         46,
         116,
         120,
         116
        ]
       ]
      }
     },
     {
      "op": "canonical_path",
      "path": {
       "utf16": [
        102,
        233,
        46,
        116,
        120,
        116
       ]
      },
      "expect": {
       "components": [
        [
         102,
         233,
         46,
         116,
         120,
         116
        ]
       ]
      }
     },
     {
      "op": "target_key",
      "path": {
       "utf16": [
        102,
        233,
        46,
        116,
        120,
        116
       ]
      },
      "expect": {
       "components": [
        [
         102,
         233,
         46,
         116,
         120,
         116
        ]
       ]
      }
     },
     {
      "op": "absolute_path",
      "path": {
       "utf16": [
        102,
        233,
        46,
        116,
        120,
        116
       ]
      },
      "expect": {
       "components": [
        [
         102,
         233,
         46,
         116,
         120,
         116
        ]
       ]
      }
     },
     {
      "op": "exists",
      "path": {
       "utf16": [
        102,
        233,
        46,
        116,
        120,
        116
       ]
      },
      "expect": {
       "ok": true
      }
     },
     {
      "op": "file_info",
      "path": {
       "utf16": [
        102,
        233,
        46,
        116,
        120,
        116
       ]
      },
      "expect": {
       "kind": "file",
       "name": [
        102,
        233,
        46,
        116,
        120,
        116
       ]
      }
     }
    ]
   },
   {
    "id": "dir/bmp",
    "steps": [
     {
      "op": "target_key",
      "path": {
       "utf16": [
        100,
        233,
        47,
        102,
        46,
        116,
        120,
        116
       ]
      },
      "expect": {
       "components": [
        [
         100,
         233
        ],
        [
         102,
         46,
         116,
         120,
         116
        ]
       ]
      }
     },
     {
      "op": "write_file",
      "path": {
       "utf16": [
        100,
        233,
        47,
        102,
        46,
        116,
        120,
        116
       ]
      },
      "content": [
       99,
       111,
       110,
       116,
       101,
       110,
       116
      ],
      "expect": {
       "ok": null
      }
     },
     {
      "op": "read_text_file",
      "path": {
       "utf16": [
        100,
        233,
        47,
        102,
        46,
        116,
        120,
        116
       ]
      },
      "expect": {
       "ok": [
        99,
        111,
        110,
        116,
        101,
        110,
        116
       ]
      }
     },
     {
      "op": "read_text_file",
      "path": {
       "utf16": [
        100,
        233,
        47,
        102,
        46,
        116,
        120,
        116
       ]
      },
      "expect": {
       "ok": [
        99,
        111,
        110,
        116,
        101,
        110,
        116
       ]
      }
     },
     {
      "op": "list_dir",
      "path": {
       "utf16": [
        46
       ]
      },
      "expect": {
       "names": [
        [
         100,
         233
        ]
       ]
      }
     },
     {
      "op": "list_dir",
      "path": {
       "utf16": [
        100,
        233
       ]
      },
      "expect": {
       "names": [
        [
         102,
         46,
         116,
         120,
         116
        ]
       ]
      }
     },
     {
      "op": "canonical_path",
      "path": {
       "utf16": [
        100,
        233,
        47,
        102,
        46,
        116,
        120,
        116
       ]
      },
      "expect": {
       "components": [
        [
         100,
         233
        ],
        [
         102,
         46,
         116,
         120,
         116
        ]
       ]
      }
     },
     {
      "op": "target_key",
      "path": {
       "utf16": [
        100,
        233,
        47,
        102,
        46,
        116,
        120,
        116
       ]
      },
      "expect": {
       "components": [
        [
         100,
         233
        ],
        [
         102,
         46,
         116,
         120,
         116
        ]
       ]
      }
     },
     {
      "op": "absolute_path",
      "path": {
       "utf16": [
        100,
        233,
        47,
        102,
        46,
        116,
        120,
        116
       ]
      },
      "expect": {
       "components": [
        [
         100,
         233
        ],
        [
         102,
         46,
         116,
         120,
         116
        ]
       ]
      }
     },
     {
      "op": "exists",
      "path": {
       "utf16": [
        100,
        233,
        47,
        102,
        46,
        116,
        120,
        116
       ]
      },
      "expect": {
       "ok": true
      }
     },
     {
      "op": "file_info",
      "path": {
       "utf16": [
        100,
        233,
        47,
        102,
        46,
        116,
        120,
        116
       ]
      },
      "expect": {
       "kind": "file",
       "name": [
        102,
        46,
        116,
        120,
        116
       ]
      }
     }
    ]
   },
   {
    "id": "file/pair",
    "steps": [
     {
      "op": "target_key",
      "path": {
       "utf16": [
        102,
        55357,
        56832,
        46,
        116,
        120,
        116
       ]
      },
      "expect": {
       "components": [
        [
         102,
         55357,
         56832,
         46,
         116,
         120,
         116
        ]
       ]
      }
     },
     {
      "op": "write_file",
      "path": {
       "utf16": [
        102,
        55357,
        56832,
        46,
        116,
        120,
        116
       ]
      },
      "content": [
       99,
       111,
       110,
       116,
       101,
       110,
       116
      ],
      "expect": {
       "ok": null
      }
     },
     {
      "op": "read_text_file",
      "path": {
       "utf16": [
        102,
        55357,
        56832,
        46,
        116,
        120,
        116
       ]
      },
      "expect": {
       "ok": [
        99,
        111,
        110,
        116,
        101,
        110,
        116
       ]
      }
     },
     {
      "op": "read_text_file",
      "path": {
       "utf16": [
        102,
        55357,
        56832,
        46,
        116,
        120,
        116
       ]
      },
      "expect": {
       "ok": [
        99,
        111,
        110,
        116,
        101,
        110,
        116
       ]
      }
     },
     {
      "op": "list_dir",
      "path": {
       "utf16": [
        46
       ]
      },
      "expect": {
       "names": [
        [
         102,
         55357,
         56832,
         46,
         116,
         120,
         116
        ]
       ]
      }
     },
     {
      "op": "canonical_path",
      "path": {
       "utf16": [
        102,
        55357,
        56832,
        46,
        116,
        120,
        116
       ]
      },
      "expect": {
       "components": [
        [
         102,
         55357,
         56832,
         46,
         116,
         120,
         116
        ]
       ]
      }
     },
     {
      "op": "target_key",
      "path": {
       "utf16": [
        102,